date_only,text,word_count,case
2025-06-04,"I just finished speaking, by telephone, with President Vladimir Putin, of Russia. The call lasted approximately one hour and 15 minutes. We discussed the attack on Russia’s docked airplanes, by Ukraine, and also various other attacks that have been taking place by both sides. It was a good conversation, but not a conversation that will lead to immediate Peace. President Putin did say, and very strongly, that he will have to respond to the recent attack on the airfields. We also discussed Iran, and the fact that time is running out on Iran’s decision pertaining to nuclear weapons, which must be made quickly! I stated to President Putin that Iran cannot have a nuclear weapon and, on this, I believe that we were in agreement. President Putin suggested that he will participate in the discussions with Iran and that he could, perhaps, be helpful in getting this brought to a rapid conclusion. It is my opinion that Iran has been slowwalking their decision on this very important matter, and we will need a definitive answer in a very short period of time!",182,Ukraine/Russia
2025-06-04,"I just finished speaking, by telephone, with President Vladimir Putin, of Russia. The call lasted approximately one hour and 15 minutes. We discussed the attack on Russia’s docked airplanes, by Ukraine, and also various other attacks that have been taking place by both sides. It was a good conversation, but not a conversation that will lead to immediate Peace. President Putin did say, and very strongly, that he will have to respond to the recent attack on the airfields. We also discussed Iran, and the fact that time is running out on Iran’s decision pertaining to nuclear weapons, which must be made quickly! I stated to President Putin that Iran cannot have a nuclear weapon and, on this, I believe that we were in agreement. President Putin suggested that he will participate in the discussions with Iran and that he could, perhaps, be helpful in getting this brought to a rapid conclusion. It is my opinion that Iran has been slowwalking their decision on this very important matter, and we will need a definitive answer in a very short period of time!",182,Ukraine/Russia
2025-06-05,"I just concluded a very good phone call with President Xi, of China, discussing some of the intricacies of our recently made, and agreed to, Trade Deal. The call lasted approximately one and a half hours, and resulted in a very positive conclusion for both Countries. There should no longer be any questions respecting the complexity of Rare Earth products. Our respective teams will be meeting shortly at a location to be determined. We will be represented by Secretary of the Treasury Scott Bessent, Secretary of Commerce Howard Lutnick, and United States Trade Representative, Ambassador Jamieson Greer. During the conversation, President Xi graciously invited the First Lady and me to visit China, and I reciprocated. As Presidents of two Great Nations, this is something that we both look forward to doing. The conversation was focused almost entirely on TRADE. Nothing was discussed concerning Russia/Ukraine, or Iran. We will inform the Media as to scheduling and location of the soon to be meeting. Thank you for your attention to this matter!",170,Ukraine/Russia
2025-06-12,"We remain committed to a Diplomatic Resolution to the Iran Nuclear Issue! My entire Administration has been directed to negotiate with Iran. They could be a Great Country, but they first must completely give up hopes of obtaining a Nuclear Weapon. Thank you for your attention to this matter!",49,Iran
2025-06-13,"I gave Iran chance after chance to make a deal. I told them, in the strongest of words, to “just do it,” but no matter how hard they tried, no matter how close they got, they just couldn’t get it done. I told them it would be much worse than anything they know, anticipated, or were told, that the United States makes the best and most lethal military equipment anywhere in the World, BY FAR, and that Israel has a lot of it, with much more to come - And they know how to use it. Certain Iranian hardliner’s spoke bravely, but they didn’t know what was about to happen. They are all DEAD now, and it will only get worse! There has already been great death and destruction, but there is still time to make this slaughter, with the next already planned attacks being even more brutal, come to an end. Iran must make a deal, before there is nothing left, and save what was once known as the Iranian Empire. No more death, no more destruction, JUST DO IT, BEFORE IT IS TOO LATE. God Bless You All!",190,Iran
2025-06-13,"Two months ago I gave Iran a 60 day ultimatum to “make a deal.” They should have done it! Today is day 61. I told them what to do, but they just couldn’t get there. Now they have, perhaps, a second chance!",42,Iran
2025-06-14,"President Putin called this morning to very nicely wish me a Happy Birthday, but to more importantly, talk about Iran, a country he knows very well. We talked at length. Much less time was spent talking about Russia/Ukraine, but that will be for next week. He is doing the planned prisoner swaps - large numbers of prisoners are being exchanged, immediately, from both sides. The call lasted approximately 1 hour. He feels, as do I, this war in Israel-Iran should end, to which I explained, his war should also end.",90,Ukraine/Russia
2025-06-15,"The U.S. had nothing to do with the attack on Iran, tonight. If we are attacked in any way, shape or form by Iran, the full strength and might of the U.S. Armed Forces will come down on you at levels never seen before. However, we can easily get a deal done between Iran and Israel, and end this bloody conflict!!!",61,Iran
2025-06-15,"Iran and Israel should make a deal, and will make a deal, just like I got India and Pakistan to make, in that case by using TRADE with the United States to bring reason, cohesion, and sanity into the talks with two excellent leaders who were able to quickly make a decision and STOP! Also, during my first term, Serbia and Kosovo were going at it hot and heavy, as they have for many decades, and this long time conflict was ready to break out into WAR. I stopped it (Biden has hurt the longer term prospects with some very stupid decisions, but I will fix it, again!). Another case is Egypt and Ethiopia, and their fight over a massive dam that is having an effect on the magnificent Nile River. There is peace, at least for now, because of my intervention, and it will stay that way! Likewise, we will have PEACE, soon, between Israel and Iran! Many calls and meetings now taking place. I do a lot, and never get credit for anything, but that’s OK, the PEOPLE understand. MAKE THE MIDDLE EAST GREAT AGAIN!",187,Iran
2025-06-16,"Iran should have signed the “deal” I told them to sign. What a shame, and waste of human life. Simply stated, IRAN CAN NOT HAVE A NUCLEAR WEAPON. I said it over and over again! Everyone should immediately evacuate Tehran!",40,Iran
2025-06-16,"Somebody please explain to kooky Tucker Carlson that,” IRAN CAN NOT HAVE A NUCLEAR WEAPON!”",15,Iran
2025-06-16,"AMERICA FIRST means many GREAT things, including the fact that, IRAN CAN NOT HAVE A NUCLEAR WEAPON. MAKE AMERICA GREAT AGAIN!!!",21,Iran
2025-06-17,"I have not reached out to Iran for “Peace Talks” in any way, shape, or form. This is just more HIGHLY FABRICATED, FAKE NEWS! If they want to talk, they know how to reach me. They should have taken the deal that was on the table - Would have saved a lot of lives!!!",54,Iran
2025-06-17,"Publicity seeking President Emmanuel Macron, of France, mistakenly said that I left the G7 Summit, in Canada, to go back to D.C. to work on a “cease fire” between Israel and Iran. Wrong! He has no idea why I am now on my way to Washington, but it certainly has nothing to do with a Cease Fire. Much bigger than that. Whether purposely or not, Emmanuel always gets it wrong. Stay Tuned!",72,Iran
2025-06-17,"We know exactly where the so-called “Supreme Leader” is hiding. He is an easy target, but is safe there - We are not going to take him out (kill!), at least not for now. But we don’t want missiles shot at civilians, or American soldiers. Our patience is wearing thin. Thank you for your attention to this matter!",58,other
2025-06-17,"We now have complete and total control of the skies over Iran. Iran had good sky trackers and other defensive equipment, and plenty of it, but it doesn’t compare to American made, conceived, and manufactured “stuff.” Nobody does it better than the good ol’ USA.",45,Iran
2025-06-19,The Wall Street Journal has No Idea what my thoughts are concerning Iran!,13,Iran
2025-06-20,"I am very happy to report that I have arranged, along with Secretary of State Marco Rubio, a wonderful Treaty between the Democratic Republic of the Congo, and the Republic of Rwanda, in their War, which was known for violent bloodshed and death, more so even than most other Wars, and has gone on for decades. Representatives from Rwanda and the Congo will be in Washington on Monday to sign Documents. This is a Great Day for Africa and, quite frankly, a Great Day for the World! I won’t get a Nobel Peace Prize for this, I won’t get a Nobel Peace Prize for stopping the War between India and Pakistan, I won’t get a Nobel Peace Prize for stopping the War between Serbia and Kosovo, I won’t get a Nobel Peace Prize for keeping Peace between Egypt and Ethiopia (A massive Ethiopian built dam, stupidly financed by the United States of America, substantially reduces the water flowing into The Nile River), and I won’t get a Nobel Peace Prize for doing the Abraham Accords in the Middle East which, if all goes well, will be loaded to the brim with additional Countries signing on, and will unify the Middle East for the first time in “The Ages!” No, I won’t get a Nobel Peace Prize no matter what I do, including Russia/Ukraine, and Israel/Iran, whatever those outcomes may be, but the people know, and that’s all that matters to me!",241,Ukraine/Russia
2025-06-21,"We have completed our very successful attack on the three Nuclear sites in Iran, including Fordow, Natanz, and Esfahan. All planes are now outside of Iran air space. A full payload of BOMBS was dropped on the primary site, Fordow. All planes are safely on their way home. Congratulations to our great American Warriors. There is not another military in the World that could have done this. NOW IS THE TIME FOR PEACE!Thank you for your attention to this matter.",80,Iran
2025-06-21,"We have completed our very successful attack on the three Nuclear sites in Iran, including Fordow, Natanz, and Esfahan. All planes are now outside of Iran air space. A full payload of BOMBS was dropped on the primary site, Fordow. All planes are safely on their way home. Congratulations to our great American Warriors. There is not another military in the World that could have done this. NOW IS THE TIME FOR PEACE! Thank you for your attention to this matter.",81,Iran
2025-06-22,"I will be giving an Address to the Nation at 10:00 P.M., at the White House, regarding our very successful military operation in Iran. This is an HISTORIC MOMENT FOR THE UNITED STATES OF AMERICA, ISRAEL, AND THE WORLD. IRAN MUST NOW AGREE TO END THIS WAR. THANK YOU!",49,Iran
2025-06-22,"I will be giving an Address to the Nation at 10:00 P.M., at the White House, regarding our very successful military operation in Iran. This is an HISTORIC MOMENT FOR THE UNITED STATES OF AMERICA, ISRAEL, AND THE WORLD. IRAN MUST NOW AGREE TO END THIS WAR. THANK YOU!",49,Iran
2025-06-22,"Congressman Thomas Massie of Kentucky is not MAGA, even though he likes to say he is. Actually, MAGA doesn’t want him, doesn’t know him, and doesn’t respect him. He is a negative force who almost always Votes “NO,” no matter how good something may be. He’s a simple minded “grandstander” who thinks it’s good politics for Iran to have the highest level Nuclear weapon, while at the same time yelling “DEATH TO AMERICA” at every chance they get. Iran has killed and maimed thousands of Americans, and even took over the American Embassy in Tehran under the Carter Administration. We had a spectacular military success yesterday, taking the “bomb” right out of their hands (and they would use it if they could!) but, as usual, and despite all of the praise and accolades received, this “lightweight” Congressman is against what was so brilliantly achieved last night in Iran. Massie is weak, ineffective, and votes “NO” on virtually everything put before him (Rand Paul, Jr.), no matter how good something may be. He is disrespectful to our great military, and all that they stand for, not even acknowledging their brilliance and bravery in yesterday’s attack, which was a total and complete WIN. Massie should drop his fake act and start putting America First, but he doesn’t know how to get there — he doesn’t have a clue! He’ll undoubtedly vote against the Great, Big, Beautiful Bill, even though non-passage means a 68% Tax Increase for everybody, and many things far worse than that. MAGA should drop this pathetic LOSER, Tom Massie, like the plague! The good news is that we will have a wonderful American Patriot running against him in the Republican Primary, and I’ll be out in Kentucky campaigning really hard. MAGA is not about lazy, grandstanding, nonproductive politicians, of which Thomas Massie is definitely one. Thank you to our incredible military for the AMAZING job they did last night. It was really SPECIAL!!! MAKE AMERICA GREAT AGAIN.",328,Iran
2025-06-22,The damage to the Nuclear sites in Iran is said to be “monumental.” The hits were hard and accurate. Great skill was shown by our military. Thank you!,28,Iran
2025-06-22,"It’s not politically correct to use the term, “Regime Change,” but if the current Iranian Regime is unable to MAKE IRAN GREAT AGAIN, why wouldn’t there be a Regime change??? MIGA!!!",31,Iran
2025-06-22,"ANY RETALIATION BY IRAN AGAINST THE UNITED STATES OF AMERICA WILL BE MET WITH FORCE FAR GREATER THAN WHAT WAS WITNESSED TONIGHT. THANK YOU! DONALD J. TRUMP, PRESIDENT OF THE UNITED STATES",32,Iran
2025-06-23,"Monumental Damage was done to all Nuclear sites in Iran, as shown by satellite images. Obliteration is an accurate term! The white structure shown is deeply imbedded into the rock, with even its roof well below ground level, and completely shielded from flame. The biggest damage took place far below ground level. Bullseye!!!",53,Iran
2025-06-23,"Did I hear Former President Medvedev, from Russia, casually throwing around the “N word” (Nuclear!), and saying that he and other Countries would supply Nuclear Warheads to Iran? Did he really say that or, is it just a figment of my imagination? If he did say that, and, if confirmed, please let me know, IMMEDIATELY. The “N word” should not be treated so casually. I guess that’s why Putin’s “THE BOSS.” By the way, if anyone thinks our “hardware” was great over the weekend, far and away the strongest and best equipment we have, 20 years advanced over the pack, is our Nuclear Submarines. They are the most powerful and lethal weapons ever built, and just launched the 30 Tomahawks — All 30 hit their mark perfectly. So, in addition to our Great Fighter Pilots, thank you to the Captain and Crew!",142,Iran
2025-06-23,"Did I hear Former President Medvedev, from Russia, casually throwing around the “N word” (Nuclear!), and saying that he and other Countries would supply Nuclear Warheads to Iran? Did he really say that or, is it just a figment of my imagination? If he did say that, and, if confirmed, please let me know, IMMEDIATELY. The “N word” should not be treated so casually. I guess that’s why Putin’s “THE BOSS.” By the way, if anyone thinks our “hardware” was great over the weekend, far and away the strongest and best equipment we have, 20 years advanced over the pack, is our Nuclear Submarines. They are the most powerful and lethal weapons ever built, and just launched the 30 Tomahawks — All 30 hit their mark perfectly. So, in addition to our Great Fighter Pilots, thank you to the Captain and Crew!",142,Iran
2025-06-23,"The sites that we hit in Iran were totally destroyed, and everyone knows it. Only the Fake News would say anything different in order to try and demean, as much as possible — And even they say they were “pretty well destroyed!” Working especially hard on this falsehood is Allison Cooper of Fake News CNN, Dumb Brian L. Roberts, Chairman of “Con”cast, Jonny Karl of ABC Fake News, and always, the Losers of, again, Concast’s NBC Fake News. It never ends with the sleazebags in the Media, and that’s why their Ratings are at an ALL TIME LOW — ZERO CREDIBILITY!",101,Iran
2025-06-23,"Iran has officially responded to our Obliteration of their Nuclear Facilities with a very weak response, which we expected, and have very effectively countered. There have been 14 missiles fired — 13 were knocked down, and 1 was “set free,” because it was headed in a nonthreatening direction. I am pleased to report that NO Americans were harmed, and hardly any damage was done. Most importantly, they’ve gotten it all out of their “system,” and there will, hopefully, be no further HATE. I want to thank Iran for giving us early notice, which made it possible for no lives to be lost, and nobody to be injured. Perhaps Iran can now proceed to Peace and Harmony in the Region, and I will enthusiastically encourage Israel to do the same. Thank you for your attention to this matter! \nDONALD J. TRUMP, PRESIDENT OF THE UNITED STATES OF AMERICA",147,Iran
2025-06-23,"CONGRATULATIONS TO EVERYONE! It has been fully agreed by and between Israel and Iran that there will be a Complete and Total CEASEFIRE (in approximately 6 hours from now, when Israel and Iran have wound down and completed their in progress, final missions!), for 12 hours, at which point the War will be considered, ENDED! Officially, Iran will start the CEASEFIRE and, upon the 12th Hour, Israel will start the CEASEFIRE and, upon the 24th Hour, an Official END to THE 12 DAY WAR will be saluted by the World. During each CEASEFIRE, the other side will remain PEACEFUL and RESPECTFUL. On the assumption that everything works as it should, which it will, I would like to congratulate both Countries, Israel and Iran, on having the Stamina, Courage, and Intelligence to end, what should be called, “THE 12 DAY WAR.” This is a War that could have gone on for years, and destroyed the entire Middle East, but it didn’t, and never will! God bless Israel, God bless Iran, God bless the Middle East, God bless the United States of America, and GOD BLESS THE WORLD! \nDONALD J. TRUMP,\nPRESIDENT OF THE UNITED STATES OF AMERICA",195,Gaza/Israel
2025-06-24,"Heading to NATO where, at worst, it will be a much calmer period than what I just went through with Israel and Iran. I look forward to seeing all of my very good European friends, and others. Hopefully, much will be accomplished!",42,Iran
2025-06-24,"THE CEASEFIRE IS NOW IN EFFECT. PLEASE DO NOT VIOLATE IT! DONALD J. TRUMP, PRESIDENT OF THE UNITED STATES!",19,Gaza/Israel
2025-06-24,"ISRAEL is not going to attack Iran. All planes will turn around and head home, while doing a friendly “Plane Wave” to Iran. Nobody will be hurt, the Ceasefire is in effect! Thank you for your attention to this matter! DONALD J. TRUMP, PRESIDENT OF THE UNITED STATES",48,Gaza/Israel
2025-06-24,"Israel & Iran came to me, almost simultaneously, and said, “PEACE!” I knew the time was NOW. The World, and the Middle East, are the real WINNERS! Both Nations will see tremendous LOVE, PEACE, AND PROSPERITY in their futures. They have so much to gain, and yet, so much to lose if they stray from the road of RIGHTEOUSNESS & TRUTH. The future for Israel & Iran is UNLIMITED, & filled with great PROMISE. GOD BLESS YOU BOTH!",78,Iran
2025-06-24,"Both Israel and Iran wanted to stop the War, equally! It was my great honor to Destroy All Nuclear facilities & capability, and then, STOP THE WAR!",27,Iran
2025-06-24,"China can now continue to purchase Oil from Iran. Hopefully, they will be purchasing plenty from the U.S., also. It was my Great Honor to make this happen!",28,Iran
2025-06-25,"Last weekend, the United States successfully carried out a massive precision strike on Iran's nuclear enrichment facilities, and it was very, very successful—It was called OBLITERATION. This incredible exercise of American strength has paved the way for peace, with a historic ceasefire agreement…",43,Iran
2025-06-25,"Steve Witkoff on the 12 Day War ceasefire: ""The proof is in the pudding, no one's shooting at each other. It's over.”",22,Gaza/Israel
2025-06-25,"FAKE NEWS CNN, TOGETHER WITH THE FAILING NEW YORK TIMES, HAVE TEAMED UP IN AN ATTEMPT TO DEMEAN ONE OF THE MOST SUCCESSFUL MILITARY STRIKES IN HISTORY. THE NUCLEAR SITES IN IRAN ARE COMPLETELY DESTROYED! BOTH THE TIIMES AND CNN ARE GETTING SLAMMED BY THE PUBLIC!",46,Iran
2025-06-25,"FAKE NEWS CNN, TOGETHER WITH THE FAILING NEW YORK TIMES, HAVE TEAMED UP IN AN ATTEMPT TO DEMEAN ONE OF THE MOST SUCCESSFUL MILITARY STRIKES IN HISTORY. THE NUCLEAR SITES IN IRAN ARE COMPLETELY DESTROYED! BOTH THE TIMES AND CNN ARE GETTING SLAMMED BY THE PUBLIC!",46,Iran
2025-06-25,"Secretary Marco Rubio: “There’s no way Iran comes to the table if somehow nothing had happened—this was COMPLETE & TOTAL OBLITERATION, they’re in bad shape…”",25,Iran
2025-06-25,"BREAKING NEWS…I was shocked to hear that the State of Israel, which has just had one of its Greatest Moments in History, and is strongly led by Bibi Netanyahu, is continuing its ridiculous Witch Hunt against their Great War Time Prime Minister! Bibi and I just went through HELL together, fighting a very tough and brilliant longtime enemy of Israel, Iran, and Bibi could not have been better, sharper, or stronger in his LOVE for the incredible Holy Land. Anybody else would have suffered losses, embarrassment, and chaos! Bibi Netanyahu was a WARRIOR, like perhaps no other Warrior in the History of Israel, and the result was something that nobody thought was possible, a complete elimination of potentially one of the biggest and most powerful Nuclear Weapons anywhere in the World, and it was going to happen, SOON! We were fighting, literally, for the Survival of Israel, and there is nobody in Israel’s History that fought harder or more competently than Bibi Netanyahu. Despite all of this, I just learned that Bibi has been summoned to Court on Monday for the continuation of this long running, (He has been going through this “Horror Show” since May of 2020 – Unheard of! This is the first time a sitting Israeli Prime Minister has ever been on trial.), politically motivated case, “concerning cigars, a Bugs Bunny doll, and numerous other unfair charges” in order to do him great harm. Such a WITCH HUNT, for a man who has given so much, is unthinkable to me. He deserves much better than this, and so does the State of Israel. Bibi Netanyahu’s trial should be CANCELLED, IMMEDIATELY, or a Pardon given to a Great Hero, who has done so much for the State. Perhaps there is no one that I know who could have worked in better harmony with the President of the United States, ME, than Bibi Netanyahu. It was the United States of America that saved Israel, and now it is going to be the United States of America that saves Bibi Netanyahu. THIS TRAVESTY OF “JUSTICE” CAN NOT BE ALLOWED!",349,Iran
2025-06-25,"Natasha Bertrand should be FIRED from CNN! I watched her for three days doing Fake News. She should be IMMEDIATELY reprimanded, and then thrown out “like a dog.” She lied on the Laptop from Hell Story, and now she lied on the Nuclear Sites Story, attempting to destroy our Patriot Pilots by making them look bad when, in fact, they did a GREAT job and hit “pay dirt” — TOTAL OBLITERATION! She should not be allowed to work at Fake News CNN. It’s people like her who destroyed the reputation of a once great Network. Her slant was so obviously negative, besides, she doesn’t have what it takes to be an on camera correspondent, not even close. FIRE NATASHA!",119,Iran
2025-06-25,This was an unbelievable hit in Iran by genius pilots and genius people in the military…,16,Iran
2025-06-25,"Israel just stated that the Nuclear Sites were OBLITERATED! Thank you to our great B-2 pilots, and all others involved!",20,Iran
2025-06-26,The Democrats are the ones who leaked the information on the PERFECT FLIGHT to the Nuclear Sites in Iran. They should be prosecuted!,23,Iran
2025-06-26,Rumor is that the Failing New York Times and Fake News CNN will be firing the reporters who made up the FAKE stories on the Iran Nuclear sites because they got it so wrong. Lets see what happens?,38,Iran
