date_only,text,word_count,case
2025-06-27,"Why would the so-called “Supreme Leader,” Ayatollah Ali Khamenei, of the war torn Country of Iran, say so blatantly and foolishly that he won the War with Israel, when he knows his statement is a lie, it is not so. As a man of great faith, he is not supposed to lie. His Country was decimated, his three evil Nuclear Sites were OBLITERATED, and I knew EXACTLY where he was sheltered, and would not let Israel, or the U.S. Armed Forces, by far the Greatest and Most Powerful in the World, terminate his life. I SAVED HIM FROM A VERY UGLY AND IGNOMINIOUS DEATH, and he does not have to say, “THANK YOU, PRESIDENT TRUMP!” In fact, in the final act of the War, I demanded that Israel bring back a very large group of planes, which were heading directly to Tehran, looking for a big day, perhaps the final knockout! Tremendous damage would have ensued, and many Iranians would have been killed. It was going to be the biggest attack of the War, by far. During the last few days, I was working on the possible removal of sanctions, and other things, which would have given a much better chance to Iran at a full, fast, and complete recovery - The sanctions are BITING! But no, instead I get hit with a statement of anger, hatred, and disgust, and immediately dropped all work on sanction relief, and more. Iran has to get back into the World Order flow, or things will only get worse for them. They are always so angry, hostile, and unhappy, and look at what it has gotten them - A burned out, blown up Country, with no future, a decimated Military, a horrible Economy, and DEATH all around them. They have no hope, and it will only get worse! I wish the leadership of Iran would realize that you often get more with HONEY than you do with VINEGAR. PEACE!!!",325,Iran
2025-06-28,Who in the Fake News Media is the SleazeBag saying that “President Trump wants to give Iran $30 Billion to build non-military Nuclear facilities.” Never heard of this ridiculous idea. It’s just another HOAX put out by the Fake News in order to demean. These people are SICK!!!,48,Iran
2025-06-28,"RT @realDonaldTrump Why would the so-called “Supreme Leader,” Ayatollah Ali Khamenei, of the war torn Country of Iran, say so blatantly and foolishly that he won the War with Israel, when he knows his statement is a lie, it is not so. As a man of great faith, he is not supposed to lie. His Country was decimated, his three evil Nuclear Sites were OBLITERATED, and I knew EXACTLY where he was sheltered, and would not let Israel, or the U.S. Armed Forces, by far the Greatest and Most Powerful in the World, terminate his life. I SAVED HIM FROM A VERY UGLY AND IGNOMINIOUS DEATH, and he does not have to say, “THANK YOU, PRESIDENT TRUMP!” In fact, in the final act of the War, I demanded that Israel bring back a very large group of planes, which were heading directly to Tehran, looking for a big day, perhaps the final knockout! Tremendous damage would have ensued, and many Iranians would have been killed. It was going to be the biggest attack of the War, by far. During the last few days, I was working on the possible removal of sanctions, and other things, which would have given a much better chance to Iran at a full, fast, and complete recovery - The sanctions are BITING! But no, instead I get hit with a statement of anger, hatred, and disgust, and immediately dropped all work on sanction relief, and more. Iran has to get back into the World Order flow, or things will only get worse for them. They are always so angry, hostile, and unhappy, and look at what it has gotten them - A burned out, blown up Country, with no future, a decimated Military, a horrible Economy, and DEATH all around them. They have no hope, and it will only get worse! I wish the leadership of Iran would realize that you often get more with HONEY than you do with VINEGAR. PEACE!!!",327,Iran
2025-06-28,"“In the past 12 days, some of the most consequential decisions in American history, those that will affect generations and leave a substantial impact on our culture, economy, and political alignment, have been made either by President Donald Trump or because of him…” https://www. washingtonexaminer.com/opinion /columnists/3456633/consequential-two-weeks-donald-trump-presidency-us-steel-iran-maga/",46,Iran
2025-06-28,"It is terrible what they are doing in Israel to Bibi Netanyahu. He is a War Hero, and a Prime Minister who did a fabulous job working with the United States to bring Great Success in getting rid of the dangerous Nuclear threat in Iran. Importantly, he is right now in the process of negotiating a Deal with Hamas, which will include getting the Hostages back. How is it possible that the Prime Minister of Israel can be forced to sit in a Courtroom all day long, over NOTHING (Cigars, Bugs Bunny Doll, etc.). It is a POLITICAL WITCH HUNT, very similar to the Witch Hunt that I was forced to endure. This travesty of “Justice” will interfere with both Iran and Hamas negotiations. In other words, it is INSANITY doing what the out-of-control prosecutors are doing to Bibi Netanyahu. The United States of America spends Billions of Dollar a year, far more than on any other Nation, protecting and supporting Israel. We are not going to stand for this. We just had a Great Victory with Prime Minister Bibi Netanyahu at the helm — And this greatly tarnishes our Victory. LET BIBI GO, HE’S GOT A BIG JOB TO DO!",201,Gaza/Israel
2025-06-29,"Republicans must remember that they are fighting against a very evil, corrupt and, in many ways, incompetent (Policywise!) group of people, who would rather see our Country “go down in flames” than do the right thing and, MAKE AMERICA GREAT AGAIN! The Democrats would LOVE to see the Biggest Tax Hike in History (68%!), No Border Spending (Open Borders!), and a weak, underfunded Military, so we wouldn’t be able to do things like we did just one week ago in Iran. We gave the Dems a Debt Extension because it was the right thing to do, but they won’t do it for us. The one thing they do have is an ability to stick together, and vote as one group (They don’t have GRANDSTANDERS!). They also have House and Senate Rules that give Great Power to their Leaders - Committee Chairmanships, etc. Republicans don’t have that, have never been able to get it, BUT THEY SHOULD! What we do have is wonderful people and phenomenal Policy, and that should win Elections every single time!",174,Iran
2025-06-29,MAKE THE DEAL IN GAZA. GET THE HOSTAGES BACK!!! DJT,10,Gaza/Israel
2025-06-29,"Regarding Iran's Fordow nuclear facility—They didn't move anything...they didn't think it was going to be actually doable, what we did…",20,Iran
2025-06-30,"Tell phony Democrat Senator Chris Coons that I am not offering Iran ANYTHING, unlike Obama, who paid them $Billions under the stupid “road to a Nuclear Weapon JCPOA (which would now be expired!), nor am I even talking to them since we totally OBLITERATED their Nuclear Facilities.",47,Iran
2025-07-01,"My Representatives had a long and productive meeting with the Israelis today on Gaza. Israel has agreed to the necessary conditions to finalize the 60 Day CEASEFIRE, during which time we will work with all parties to end the War. The Qataris and Egyptians, who have worked very hard to help bring Peace, will deliver this final proposal. I hope, for the good of the Middle East, that Hamas takes this Deal, because it will not get better — IT WILL ONLY GET WORSE. Thank you for your attention to this matter!",92,Gaza/Israel
2025-07-04,"It was my great honor to welcome Edan Alexander, held hostage by Hamas for 584 days—to the Oval Office with his loved ones. We remain committed to bringing every hostage home!",31,Gaza/Israel
2025-07-08,"A new Study by the Council of Economic Advisers (CEA), led by Highly Respected Chair, Dr. Stephen Miran, has found that Tariffs have had ZERO IMPACT on Inflation. In fact, the Study shows that Import Prices are actually DROPPING, just like I always said they would. The Fake News and the so-called “Experts” were wrong again. Tariffs are making our Country “BOOM.” Many new Factories, Jobs, and TRILLIONS OF DOLLARS in Investments are pouring into the U.S.A. Someone should show this new Study to “Too Late” Jerome Powell, who has been whining like a baby about non-existent Inflation for months, and refusing to do the right thing. CUT INTEREST RATES JEROME — NOW IS THE TIME!",116,Iran
2025-07-10,"I am announcing a 50% TARIFF on Copper, effective August 1, 2025, after receiving a robust NATIONAL SECURITY ASSESSMENT. Copper is necessary for Semiconductors, Aircraft, Ships, Ammunition, Data Centers, Lithium-ion Batteries, Radar Systems, Missile Defense Systems, and even, Hypersonic Weapons, of which we are building many. Copper is the second most used material by the Department of Defense! Why did our foolish (and SLEEPY!) “Leaders” decimate this important Industry? This 50% TARIFF will reverse the Biden Administration’s thoughtless behavior, and stupidity. America will, once again, build a DOMINANT Copper Industry. THIS IS, AFTER ALL, OUR GOLDEN AGE!",97,other
2025-07-11,Thank you USA TODAY. So nice! \n“Trump deserves Nobel Peace Prize. He's achieved more than those who've won before” https://www. usatoday.com/story/opinion/col umnist/2025/07/10/trump-netanyahu-nobel-prize-israel-iran/84505423007/,22,Gaza/Israel
2025-07-12,"What’s going on with my “boys” and, in some cases, “gals?” They’re all going after Attorney General Pam Bondi, who is doing a FANTASTIC JOB! We’re on one Team, MAGA, and I don’t like what’s happening. We have a PERFECT Administration, THE TALK OF THE WORLD, and “selfish people” are trying to hurt it, all over a guy who never dies, Jeffrey Epstein. For years, it’s Epstein, over and over again. Why are we giving publicity to Files written by Obama, Crooked Hillary, Comey, Brennan, and the Losers and Criminals of the Biden Administration, who conned the World with the Russia, Russia, Russia Hoax, 51 “Intelligence” Agents, “THE LAPTOP FROM HELL,” and more? They created the Epstein Files, just like they created the FAKE Hillary Clinton/Christopher Steele Dossier that they used on me, and now my so-called “friends” are playing right into their hands. Why didn’t these Radical Left Lunatics release the Epstein Files? If there was ANYTHING in there that could have hurt the MAGA Movement, why didn’t they use it? They haven’t even given up on the John F. Kennedy or Martin Luther King, Jr. Files. No matter how much success we have had, securing the Border, deporting Criminals, fixing the Economy, Energy Dominance, a Safer World where Iran will not have Nuclear Weapons, it’s never enough for some people. We are about to achieve more in 6 months than any other Administration has achieved in over 100 years, and we have so much more to do. We are saving our Country and, MAKING AMERICA GREAT AGAIN, which will continue to be our complete PRIORITY. The Left is imploding! Kash Patel, and the FBI, must be focused on investigating Voter Fraud, Political Corruption, ActBlue, The Rigged and Stolen Election of 2020, and arresting Thugs and Criminals, instead of spending month after month looking at nothing but the same old, Radical Left inspired Documents on Jeffrey Epstein. LET PAM BONDI DO HER JOB — SHE’S GREAT! The 2020 Election was Rigged and Stolen, and they tried to do the same thing in 2024 — That’s what she is looking into as AG, and much more. One year ago our Country was DEAD, now it’s the “HOTTEST” Country anywhere in the World. Let’s keep it that way, and not waste Time and Energy on Jeffrey Epstein, somebody that nobody cares about. Thank you for your attention to this matter!",399,Iran
2025-07-19,"All three nuclear sites in Iran were completely destroyed and/or OBLITERATED. It would take years to bring them back into service and, if Iran wanted to do so, they would be much better off starting anew, in three different locations, prior to those sites being obliterated, should they decide to do so. Thank you for your attention to this matter!",60,Iran
2025-07-22,"Iran’s Foreign Minister, Abbas Araghchi, on the Iran Nuclear Sites: “Damages are very severe, they are destroyed.” Of course they are, just like I said, and we will do it again, if necessary! As interviewed by Bret Baier. Fake News CNN should immediately fire their phony “reporter” and apologize to me and the great pilots who “OBLITERATED” Iran’s nuclear sites. CNN is a major ratings loser, as is MSDNC!",69,Iran
2025-07-26,"Just spoke to the Prime Minister of Cambodia relative to stopping the War with Thailand. I am calling the Acting Prime Minister of Thailand, right now, to likewise request a Ceasefire, and END to the War, which is currently raging. We happen to be, by coincidence, currently dealing on Trade with both Countries, but do not want to make any Deal, with either Country, if they are fighting — And I have told them so! The call with Thailand is being made momentarily. The call with Cambodia has ended, but expect to call back regarding War stoppage and Ceasefire based on what Thailand has to say. I am trying to simplify a complex situation! Many people are being killed in this War, but it very much reminds me of the Conflict between Pakistan and India, which was brought to a successful halt.",142,Gaza/Israel
2025-07-26,"I have just spoken to the Acting Prime Minister of Thailand, and it was a very good conversation. Thailand, like Cambodia, wants to have an immediate Ceasefire, and PEACE. I am now going to relay that message back to the Prime Minister of Cambodia. After speaking to both Parties, Ceasefire, Peace, and Prosperity seems to be a natural. We will soon see!",62,Gaza/Israel
2025-07-26,"I just had a very good call with the Prime Minister of Cambodia, and informed him of my discussions with Thailand, and its Acting Prime Minister. Both Parties are looking for an immediate Ceasefire and Peace. They are also looking to get back to the “Trading Table” with the United States, which we think is inappropriate to do until such time as the fighting STOPS. They have agreed to immediately meet and quickly work out a Ceasefire and, ultimately, PEACE! It was an Honor to deal with both Countries. They have a long and storied History and Culture. They will hopefully get along for many years to come. When all is done, and Peace is at hand, I look forward to concluding our Trading Agreements with both!",127,Gaza/Israel
2025-07-28,"Just spoke to the Acting Prime Minister of Thailand and Prime Minister of Cambodia. I am pleased to announce that, after the involvement of President Donald J. Trump, both Countries have reached a CEASEFIRE and PEACE. Congratulations to all! By ending this War, we have saved thousands of lives. I have instructed my Trade Team to restart negotiations on Trade. I have now ended many Wars in just six months — I am proud to be the President of PEACE!",80,Gaza/Israel
2025-07-29,"“From Iran to the border, Trump takes on America’s toughest fights” https://www. washingtontimes.com/news/2025/ jul/3/iran-border-trump-takes-americas-toughest-fights/",14,Iran
2025-07-31,The fastest way to end the Humanitarian Crises in Gaza is for Hamas to SURRENDER AND RELEASE THE HOSTAGES!!!,19,Gaza/Israel
2025-08-01,"Based on the highly provocative statements of the Former President of Russia, Dmitry Medvedev, who is now the Deputy Chairman of the Security Council of the Russian Federation, I have ordered two Nuclear Submarines to be positioned in the appropriate regions, just in case these foolish and inflammatory statements are more than just that. Words are very important, and can often lead to unintended consequences, I hope this will not be one of those instances. Thank you for your attention to this matter!",83,Iran
2025-08-03,"The very wonderful and talented Lara Trump, whose show is a big ratings success, put racist sleazebag Charlamagne “The God” (Why is he allowed to use the word “GOD” when describing himself? Can anyone imagine the uproar there would be if I used that nickname?). He’s a Low IQ individual, has no idea what words are coming out of his mouth, and knows nothing about me or what I have done - like just ending 5 Wars, including a 31 year bloodbath between Republic of the Congo and Rwanda, where Seven Million people have died, and there was no end in sight. He didn’t know that, or India and Pakistan or, wiping out Iran’s nuclear capabilities, or closing the horrendous open Border, or creating the greatest economy, where prices and Inflation have come way down, and where STUPID and CORRUPT JOE BIDEN set the record for doing the Worst Job as President, EVER. But this dope, Charlamagne, would vote for Sleepy Joe or Kamala? Remember, one year ago our Country was DEAD, now it’s the “HOTTEST” Country anywhere in the World. MAGA!!!",182,Iran
2025-08-07,"Now that the nuclear arsenal being “created” by Iran has been totally OBLITERATED, it is very important to me that all Middle Eastern Countries join the Abraham Accords. This will insure PEACE IN THE MIDDLE EAST. Thank you for your attention to this matter!",44,Iran
2025-08-07,"It is my Great Honor to announce that I have chosen Dr. Stephen Miran, current Chairman of the Council of Economic Advisors, to serve in the just vacated seat on the Federal Reserve Board until January 31, 2026. In the meantime, we will continue to search for a permanent replacement. Stephen has a Ph.D. in Economics from Harvard University, and served with distinction in my First Administration. He has been with me from the beginning of my Second Term, and his expertise in the World of Economics is unparalleled — He will do an outstanding job. Congratulations Stephen!",98,Iran
2025-08-16,"A great and very successful day in Alaska! The meeting with President Vladimir Putin of Russia went very well, as did a late night phone call with President Zelenskyy of Ukraine, and various European Leaders, including the highly respected Secretary General of NATO. It was determined by all that the best way to end the horrific war between Russia and Ukraine is to go directly to a Peace Agreement, which would end the war, and not a mere Ceasefire Agreement, which often times do not hold up. President Zelenskyy will be coming to D.C., the Oval Office, on Monday afternoon. If all works out, we will then schedule a meeting with President Putin. Potentially, millions of people’s lives will be saved. Thank you for your attention to this matter!",129,Ukraine/Russia
2025-08-18,"RT @RealRogerStone President Trump Has Achieved Peace Between: \n–India & Pakistan \n–Israel & Iran (Ceasefire) \n–Serbia & Kosovo (Trump’s intervention deterred escalation) \n–Congo & Rwanda \n–Thailand & Cambodia (Border-Clashes Ceasefire) \n–Armenia & Azerbaijan \n–Saudi Arabia, Syria, Lebanon (Abraham Accords) \nAnd now the fake news media shamelessly attack Trump because he hasn’t YET finished bringing peace between Ukraine and Russia! 🤡",60,Gaza/Israel
2025-08-18,"We will only see the return of the remaining hostages when Hamas is confronted and destroyed!!! The sooner this takes place, the better the chances of success will be. Remember, I was the one who negotiated and got hundreds of hostages freed and released into Israel (and America!). I was the one who ended 6 wars, in just 6 months. I was the one who OBLITERATED Iran’s Nuclear facilities. Play to WIN, or don’t play at all! Thank you for your attention to this matter! President DJT",87,Gaza/Israel
2025-08-18,"I’ve settled 6 Wars in 6 months, one of them a possible Nuclear disaster, and yet I have to read & listen to the Wall Street Journal, and many other who truly don’t have a clue, tell me everything that I am doing wrong on the Russia/Ukraine MESS, that is Sleepy Joe Biden’s war, not mine. I’m only here to stop it, not to prosecute it any further. It would have NEVER happened if I was President. I know exactly what I’m doing, and I don’t need the advice of people who have been working on all of these conflicts for years, and were never able to do a thing to stop them. They are “STUPID” people, with no common sense, intelligence, or understanding, and they only make the current R/U disaster more difficult to FIX. Despite all of my lightweight and very jealous critics, I’ll get it done — I always do!!! President DJT",155,Ukraine/Russia
2025-08-31,"Miranda Devine and Katie Pavlich were terrific on FoxNews yesterday. Smart, exciting, and really know their “stuff.” Two great professionals. Thank you!!! President DJT",24,Iran
2025-09-03,"Tell Hamas to IMMEDIATELY give back all 20 Hostages (Not 2 or 5 or 7!), and things will change rapidly. IT WILL END!",23,Gaza/Israel
2025-09-07,"Everyone wants the Hostages HOME. Everyone wants this War to end! The Israelis have accepted my Terms. It is time for Hamas to accept as well. I have warned Hamas about the consequences of not accepting. This is my last warning, there will not be another one! Thank you for your attention to this matter.\nDONALD J. TRUMP, PRESIDENT OF THE UNITED STATES OF AMERICA",64,Gaza/Israel
2025-09-09,"This morning, the Trump Administration was notified by the United States Military that Israel was attacking Hamas which, very unfortunately, was located in a section of Doha, the Capital of Qatar. This was a decision made by Prime Minister Netanyahu, it was not a decision made by me. Unilaterally bombing inside Qatar, a Sovereign Nation and close Ally of the United States, that is working very hard and bravely taking risks with us to broker Peace, does not advance Israel or America’s goals. However, eliminating Hamas, who have profited off the misery of those living in Gaza, is a worthy goal. I immediately directed Special Envoy Steve Witkoff to inform the Qataris of the impending attack, which he did, however, unfortunately, too late to stop the attack. I view Qatar as a strong Ally and friend of the U.S., and feel very badly about the location of the attack. I want ALL of the Hostages, and bodies of the dead, released, and this War to END, NOW! I also spoke to Prime Minister Netanyahu after the attack. The Prime Minister told me that he wants to make Peace. I believe this unfortunate incident could serve as an opportunity for PEACE. I also spoke to the Emir and Prime Minister of Qatar, and thanked them for their support and friendship to our Country. I assured them that such a thing will not happen again on their soil. I have directed Secretary of State, Marco Rubio, to finalize the Defense Cooperation Agreement with Qatar. Thank you for your attention to this matter!",260,Gaza/Israel
2025-09-09,"I am pleased to report that Elizabeth Tsurkov, a Princeton Student, whose sister is an American Citizen, was just released by Kata’ib Hezbollah (MILITANT Hezbollah), and is now safely in the American Embassy in Iraq after being tortured for many months. I will always fight for JUSTICE, and never give up. HAMAS, RELEASE THE HOSTAGES, NOW!",56,Gaza/Israel
2025-09-15,"I have just read a News Report that Hamas has moved the hostages above ground to use them as human shields against Israel’s ground offensive. I hope the Leaders of Hamas know what they’re getting into if they do such a thing. This is a human atrocity, the likes of which few people have ever seen before. Don’t let this happen or, ALL “BETS” ARE OFF. RELEASE ALL HOSTAGES NOW!",70,Gaza/Israel
2025-09-16,"RT @realDonaldTrump I have just read a News Report that Hamas has moved the hostages above ground to use them as human shields against Israel’s ground offensive. I hope the Leaders of Hamas know what they’re getting into if they do such a thing. This is a human atrocity, the likes of which few people have ever seen before. Don’t let this happen or, ALL “BETS” ARE OFF. RELEASE ALL HOSTAGES NOW!",72,Gaza/Israel
2025-09-26,"I am pleased to report that we are having very inspired and productive discussions with the Middle Eastern Community concerning Gaza. Intense negotiations have been going on for four days, and will continue for as long as necessary in order to get a Successfully Completed Agreement. All of the Countries within the Region are involved, Hamas is very much aware of these discussions, and Israel has been informed at all levels, including Prime Minister Bibi Netanyahu. There is more Goodwill and Enthusiasm for getting a Deal done, after so many decades, than I have ever seen before. Everyone is excited to put this period of Death and Darkness behind them. It is an Honor to be a part of this Negotiation. We must get the Hostages back, and get a PERMANENT AND LONGLASTING PEACE!",134,Gaza/Israel
2025-09-27,"At the request of Secretary of Homeland Security, Kristi Noem, I am directing Secretary of War, Pete Hegseth, to provide all necessary Troops to protect War ravaged Portland, and any of our ICE Facilities under siege from attack by Antifa, and other domestic terrorists. I am also authorizing Full Force, if necessary. Thank you for your attention to this matter!",60,other
2025-09-30,"RT @narendramodi We welcome President Donald J. Trump’s announcement of a comprehensive plan to end the Gaza conflict. It provides a viable pathway to long term and sustainable peace, security and development for the Palestinian and Israeli people, as also for the larger West Asian region. We hope that all concerned will come together behind President Trump’s initiative and support this effort to end conflict and secure peace. \n @realDonaldTrump",70,Gaza/Israel
